start,end,text
00:40:29,00:40:34,"Esto es lo que estoy entendiendo. Entonces, el ticket contiene la información de la obra."
00:40:36,00:41:00,"Usted menciona la fecha y la fecha de la obra, o sea, ¿eso es la fecha de la obra? ¿Como cuando empezó la obra o algo así? La fecha que se ejecute el ticket, que puede ser incluso, no sé cómo se llama, que se coloque sola. Autollenable. De hecho hay que no la coloque el cliente."
00:41:01,00:41:09,"Sí. Cuando yo abro y pincho un ticket, va a salir el número del ticket automático y automáticamente también la fecha."
00:41:10,00:41:56,"También va a salir, a lo mejor, no sé cómo lo íbamos a hacer para que fuera un usuario. A lo mejor si el usuario ya tiene clave, con su clave solo también va a ser autollenado el nombre del usuario. O quien escribe el... como se llama el ticket que es lo que está ejecutando el ticket ya si entiendo ahora si entiendo no se si los chicos tienen alguna duda con respecto al ticket no se si creo haberla entendido ya"
00:42:00,00:42:02,"Bueno, entonces siguiendo."
00:42:05,00:42:18,"Dice allá el otro. Bueno, lo último es que, como le dije, vamos a presentar como un dash donde usted va a poder ver los los datos datos."
00:42:21,00:42:25,"Como le mencioné, no sé cuántos días lleva este ticket abierto."
00:42:27,00:42:31,"Tratar de categorizar las fallas más comunes, cosas así."
00:42:33,00:42:59,"Nosotros podemos, a partir de la información que vamos a recopilar, de la información que podemos tener, hacer gráficos y de ese tipo. Pero nos gustaría saber cuáles son los datos importantes que usted necesita como para apuntar el desarrollo en esa dirección. Espera un poco."
00:43:10,00:43:26,"Chicos, vamos viendo los tiempos también, porque a las seis conecta el otro equipo, por favor, ¿ya? Sí, sí, no, si ya está el último punto. Ya, los datos que yo necesito que se muestren, o que yo, para poder hacer control,"
00:43:27,00:43:58,"es básicamente que aparezca en un gráfico, y abajo la leyenda del gráfico, donde indique cuántos tickets están abiertos, cuántas observaciones de ese ticket están abiertas o están cerradas, cuántos tickets están cerrados, cuántos tickets están en proceso, y eso va en un gráfico, puede ser de cualquier tipo, puede ser un gráfico de circular, un gráfico de barra, Eso se determina."
00:44:00,00:44:19,"¿Cuáles son las observaciones más incidentes? Si son observaciones de instalaciones sanitarias, de infernalizaciones, de eléctricas, etcétera, etcétera. Y esa es como la base, en realidad no necesito más información que esa. Bien."
00:44:21,00:44:33,"¿Ya? ¿Sí? Esas son como nuestras dudas que teníamos, no sé si... ¿Qué más?"
00:44:34,00:44:54,"Sí, se supone que en la reunión anterior que yo no estaba porque me integré recién al grupo, pero creo que era que teníamos que incluir los correos anteriores al sistema, ¿no? Y quería preguntarle que si tenía como un ejemplo del correo que le llega."
00:44:57,00:45:04,"Como para ver qué tipo de estructura tiene. A ver."
00:45:07,00:45:15,"Esa es una adicional básicamente. Hoy día lo que no interesa es que"
00:45:19,00:45:28,"la información que nosotros podamos, o la comunicación que tengamos con nuestro cliente, sea guardada en alguna parte."
00:45:30,00:45:42,"Y que sea guardada por proyecto, con fecha, que sea fácil de búsqueda. Me imagino, Arturo, entendí que íbamos a aplicar la guía también ahí. Exacto."
00:45:44,00:46:05,"Y esa es como la base de este sistema, como un sistema nuevo, como va a ser un software nuevo para nosotros. Evidentemente, la idea era tomar los correos electrónicos anteriores a este software para poder complementarlo o guardarlo dentro de este sistema."
00:46:08,00:46:18,"No hay un formato específico. Solo hay correos de clientes que son arroaxempresa, arroa, por ejemplo, UC."
00:46:20,00:46:33,"Entonces, se van a guardar todos los arroa UC. Y cualquier conversación que exista en arroa UC. Creo que también le podemos decir a la guía que indique que guarde..."
00:46:37,00:47:06,"todo lo que tenga alusión a solicitudes de postventa o de reparación, que contenga la palabra en los correos anteriores. Es así, ¿no, Arturo? ¿Verdad? Eso es lo que habíamos hablado. Sí, claro, pero tal cual lo mencionaste, que lo habíamos dejado quizás para una futura mejora, que tu primer objetivo era poder visualizar la trazabilidad de todos los proyectos, el estado de los proyectos y la trazabilidad de los clientes."
00:47:08,00:47:12,"Claro, pero desde cuando empecemos a ocupar el software, en adelante."
00:47:14,00:47:37,"Claro. ¿Sí? Claro. No del software para atrás, porque evidentemente es otro trabajo, es otra cosa y es... Otra investigación, claro, claro, te entiendo. Lo habíamos contado por eso. No obstante, lo habíamos dejado ahí en el tapete, si es que se iba a incluir o no se iba a incluir. Claro. Ahora, como les digo, si está el tiempo y se puede hacer, genial sería."
00:47:38,00:48:06,"Pero si no está el tiempo y ya es difícil de hacer, yo lo dejaría atrás. Es una buena oferta, cabrón. Bueno, esas son nuestras... Yo tengo otra pregunta. Usted nos dijo que cada cliente tiene una obra. O sea, una obra puede tener dos clientes, ¿no? Una obra puede tener dos usuarios."
00:48:07,00:48:13,"Ajá. La cosa es, ¿estos usuarios hay una posibilidad de que se repitan en otras obras? No."
00:48:15,00:48:21,"Entonces, ¿el correo es único? No, es único. Ya. Entonces, ¿el login sería con correo?"
00:48:23,00:48:26,"¿Perdón? ¿El login, como el inicio de sesión, sería con el correo?"
00:48:28,00:48:50,"Podría ser con el correo institucional del usuario, sí. Sí. Nosotros hicimos un login, que Gis lo puede mostrar, como para que vean más o menos cómo va estilizado el desarrollo."
00:49:05,00:49:06,"La foto se puede cambiar, ¿no?"
00:49:08,00:49:19,"Sí, o sea, claro. Porque ahí va, la foto, colocar la foto va a ser decisión de gerencia, qué foto vamos a instalar. Claro, nosotros una foto como de una construcción en Google para que haya algo."
00:49:21,00:49:28,"Pero, claro, eso es lo que... No, se ve súper bien. O sea, ese es como el inicio, está muy bien."
00:49:29,00:49:43,"Claro, tenemos unos mockups, o sea, como una idea de lo que puede ser el ingreso de tickets, pero claro, todavía no está desarrollado como tal. Ya."
00:49:44,00:49:54,"Sí. No hay problema, cuando tengan algo, aunque sea de maqueta, podré mostrarlo para ver cómo va un poco. O sea, ¿lo podemos mostrar si lo tenemos acá?"
00:49:55,00:50:10,"Sí, si tenéis una marquita, feliz. No hay problema. Ah, escucha, no. Tendría que salirme para... No sé si tiene el mockup ahí. Lo envío por WhatsApp. Tendría que salirme para compartir la pantalla."
00:50:12,00:50:15,"¿A quién le dice? ¿A mí o a los...? No, a la Gis. A la Gis."
00:50:35,00:51:00,"Si es que no, más adelante lo pueden mandar por correo a la galería de imágenes y como para que Francisco también tenga un tiempo un poquito más tranquilo para que haga una crítica constructiva. Y no, si me gustó o no me gustó, un debate de abajo es muy ambiguo. Yo necesito que también necesitamos que Francisco nos valide la interfaz y que entienda él también cómo va a capturar los datos, tanto el cliente y cómo él va a visualizar los datos en el dashboard."
00:51:01,00:51:11,"Ya. ¿Ya? ¿Lo dejamos en eso? Sí, si tienen las imágenes, solo con imágenes, ya uno va a entender al tiro de cómo va a funcionar el tema."
00:51:12,00:51:14,"Así que cuando me manden la imagen no hay ningún problema."
00:51:15,00:51:19,"Ya, sí, yo se la puedo enviar por mail. Ok."
00:51:24,00:51:34,"Vamos a cerrar ahora la sesión. Te agradezco, Francisco. Francisco, disculpa, pero te acabo de mandar un segundo correo para el segundo link del segundo grupo. Ok, voy. Gracias."
00:51:48,00:51:50,"Se está grabando, está todo bien, por si acaso. Ya."
00:51:51,00:51:52,"¿Va?"
00:51:53,00:51:57,"¿A qué hice? ¿Está bien? Supongo que vamos bien."
00:52:00,00:52:01,"Sí que es, ya."
00:52:02,00:52:06,"Ahí nos vemos, hablamos después. Ya, chau. Chau, chau."
